{
  "config_version": "1.1.0",
  "inquiry_statuses": [
    "DRAFT",
    "QUESTIONNAIRE_IN_PROGRESS",
    "PRODUCT_VALIDATION_FAILED",
    "AI_GUIDANCE_READY",
    "CONSULTATION_PENDING",
    "CONSULTATION_IN_PROGRESS",
    "VISIT_REVIEW_PENDING",
    "VISIT_PENDING",
    "VISIT_IN_PROGRESS",
    "COMPLETION_PENDING",
    "RESOLVED",
    "REOPENED"
  ],
  "consultation_statuses": [
    "WAITING",
    "ASSIGNED",
    "IN_PROGRESS",
    "COMPLETED",
    "CANCELLED"
  ],
  "visit_statuses": [
    "ASSIGNING",
    "SCHEDULING",
    "CONFIRMED",
    "IN_PROGRESS",
    "COMPLETED",
    "CANCELLED"
  ],
  "risk_levels": [
    "general",
    "caution",
    "danger"
  ],
  "usage_guidance_statuses": [
    "NORMAL",
    "PARTIAL_STOP",
    "TOTAL_STOP",
    "PENDING_CONSULTATION"
  ],
  "allowed_actions": {
    "DRAFT": [
      "SUBMIT_SYMPTOM"
    ],
    "QUESTIONNAIRE_IN_PROGRESS": [
      "SUBMIT_ANSWERS"
    ],
    "PRODUCT_VALIDATION_FAILED": [
      "UPDATE_PRODUCT",
      "SUBMIT_SYMPTOM"
    ],
    "AI_GUIDANCE_READY": [
      "CUSTOMER_REPORTED_SELF_RESOLVED",
      "REQUEST_CONSULTATION"
    ],
    "CONSULTATION_PENDING": [
      "START_CONSULTATION"
    ],
    "CONSULTATION_IN_PROGRESS": [
      "CONSULTATION_COMPLETED",
      "VISIT_NEEDED"
    ],
    "VISIT_REVIEW_PENDING": [
      "UPDATE_VISIT_SCHEDULE",
      "CONFIRM_VISIT"
    ],
    "VISIT_PENDING": [
      "UPDATE_VISIT_SCHEDULE",
      "START_VISIT"
    ],
    "VISIT_IN_PROGRESS": [
      "VISIT_COMPLETED"
    ],
    "COMPLETION_PENDING": [
      "SUBMIT_RESOLUTION_FEEDBACK",
      "FINALIZE_INQUIRY",
      "RESUME_CONSULTATION"
    ],
    "RESOLVED": [
      "RESUME_CONSULTATION"
    ],
    "REOPENED": [
      "START_CONSULTATION"
    ]
  }
}
